{
  "request_id": "request-applicability-001",
  "actor": {"type": "ai_agent", "id": "synthetic-agent"},
  "action": "external_publish",
  "target": "synthetic-public-destination",
  "applicability_context": {
    "jurisdiction": "JP",
    "data_class": "public_content"
  },
  "context": {
    "authority_confirmed": false,
    "human_approval_present": false
  },
  "evidence_scope": {
    "available": ["draft-content"],
    "missing": ["authority-record", "human-approval-record"]
  }
}
